{"version":1,"business":{"name":"Luxury Leather Bags","model":"direct_to_consumer"},"industry":"luxury_fashion","subcategory":"leather_bags","catalog":{"product_count":18,"product_types":["bags","small_leather_goods"],"has_variants":true,"price_positioning":"premium"},"audience":{"primary":"considered luxury shoppers","needs":["material context","collection discovery"]},"goals":{"primary":["luxury"],"secondary":["story_first"]},"assets":{"available":["founder_portrait","craft_media"],"notes":["Merchant has supplied approved founder and workshop media."]},"preferences":{"page_type":"homepage","design_languages":["luxury","editorial"],"color_strategies":["luxury"],"image_styles":["luxury"],"content_density":"low"},"brand_personality":{"primary":"luxury","secondary":["sophisticated"]}}
