{"version":1,"business":{"name":"Digital Products Sample","model":"software_subscription"},"industry":"digital_products","subcategory":"productivity","catalog":{"product_count":5,"product_types":["software_plans"],"has_variants":true,"price_positioning":"mid_market"},"audience":{"primary":"knowledge workers","needs":["outcome clarity","trust"]},"goals":{"primary":["trust_first"],"secondary":["education_first"]},"assets":{"available":[],"notes":[]},"preferences":{"page_type":"homepage","design_languages":["technical"],"color_strategies":["minimal"],"image_styles":["technical"],"content_density":"medium"},"brand_personality":{"primary":"technical","secondary":["modern"]}}
