{"version":1,"business":{"name":"Jewelry Sample","model":"direct_to_consumer"},"industry":"jewelry","subcategory":"fine_jewelry","catalog":{"product_count":30,"product_types":["rings","necklaces"],"has_variants":true,"price_positioning":"premium"},"audience":{"primary":"gift and occasion shoppers","needs":["detail visibility","purchase confidence"]},"goals":{"primary":["luxury"],"secondary":["trust_first"]},"assets":{"available":[],"notes":[]},"preferences":{"page_type":"homepage","design_languages":["luxury"],"color_strategies":["luxury"],"image_styles":["luxury"],"content_density":"low"},"brand_personality":{"primary":"luxury","secondary":["sophisticated"]}}
