{"version":1,"business":{"name":null,"model":null},"industry":null,"subcategory":null,"catalog":{"product_count":null,"product_types":[],"has_variants":null,"price_positioning":null},"audience":{"primary":null,"needs":[]},"goals":{"primary":[],"secondary":[]},"assets":{"available":[],"notes":[]},"preferences":{"page_type":"homepage","design_languages":[],"color_strategies":[],"image_styles":[],"content_density":null},"brand_personality":{"primary":null,"secondary":[]}}
