{"version":1,"business":{"name":"Beauty Sample","model":"direct_to_consumer"},"industry":"beauty","subcategory":"skin_care","catalog":{"product_count":12,"product_types":["skin_care"],"has_variants":false,"price_positioning":"premium"},"audience":{"primary":"routine-focused shoppers","needs":["product context","ingredient clarity"]},"goals":{"primary":["trust_first"],"secondary":["education_first"]},"assets":{"available":[],"notes":[]},"preferences":{"page_type":"homepage","design_languages":["lifestyle"],"color_strategies":["warm"],"image_styles":["beauty"],"content_density":"medium"},"brand_personality":{"primary":"warm","secondary":["modern"]}}
