{"version":1,"business":{"name":"Furniture Sample","model":"direct_to_consumer"},"industry":"furniture","subcategory":"living_room","catalog":{"product_count":40,"product_types":["seating","tables"],"has_variants":true,"price_positioning":"premium"},"audience":{"primary":"home planners","needs":["scale context","material information"]},"goals":{"primary":["story_first"],"secondary":["product_first"]},"assets":{"available":[],"notes":[]},"preferences":{"page_type":"homepage","design_languages":["editorial"],"color_strategies":["neutral"],"image_styles":["architecture"],"content_density":"medium"},"brand_personality":{"primary":"sophisticated","secondary":["modern"]}}
