{"version":1,"business":{"name":"Electronics Sample","model":"direct_to_consumer"},"industry":"electronics","subcategory":"consumer_devices","catalog":{"product_count":24,"product_types":["devices","accessories"],"has_variants":true,"price_positioning":"mid_market"},"audience":{"primary":"comparison-oriented shoppers","needs":["specification clarity","compatibility confidence"]},"goals":{"primary":["education_first"],"secondary":["product_first"]},"assets":{"available":[],"notes":[]},"preferences":{"page_type":"homepage","design_languages":["technical"],"color_strategies":["technical"],"image_styles":["technical"],"content_density":"high"},"brand_personality":{"primary":"technical","secondary":["confident"]}}
