{"version":1,"business":{"name":"Food Sample","model":"direct_to_consumer"},"industry":"food_beverage","subcategory":"pantry_goods","catalog":{"product_count":16,"product_types":["food","gifts"],"has_variants":false,"price_positioning":"premium"},"audience":{"primary":"ingredient-conscious shoppers","needs":["product discovery","process context"]},"goals":{"primary":["story_first"],"secondary":["education_first"]},"assets":{"available":[],"notes":[]},"preferences":{"page_type":"homepage","design_languages":["artisan"],"color_strategies":["warm"],"image_styles":["lifestyle"],"content_density":"medium"},"brand_personality":{"primary":"warm","secondary":["traditional"]}}
