{"version":1,"business":{"name":"Hospitality Sample","model":"booking_enquiry"},"industry":"hospitality","subcategory":"boutique_stay","catalog":{"product_count":null,"product_types":["stays","experiences"],"has_variants":null,"price_positioning":"premium"},"audience":{"primary":"experience-led travellers","needs":["sense of place","booking confidence"]},"goals":{"primary":["story_first"],"secondary":["trust_first"]},"assets":{"available":[],"notes":["No behind-the-scenes media has been confirmed."]},"preferences":{"page_type":"homepage","design_languages":["editorial"],"color_strategies":["dark"],"image_styles":["architecture"],"content_density":"medium"},"brand_personality":{"primary":"sophisticated","secondary":["modern"]}}
